{
  "$schema": "../schemas/tower.schema.json",
  "id": "lightning_tower",
  "name": "Lightning Tower",
  "cost": 150,
  "detection_range": 9.0,
  "turn_speed": 180.0,
  "attack": {
    "damage": 12,
    "cooldown": 1.2,
    "range": 6.0,
    "projectile_speed": 12.0
  },
  "targeting": {
    "targets": ["ground"],
    "priority": "nearest"
  },
  "damage_type": "electric",
  "tags": ["electric"]
}
