{
  "$schema": "../schemas/tower.schema.json",
  "id": "laser_tower",
  "name": "Laser Tower",
  "cost": 90,
  "detection_range": 9.0,
  "turn_speed": 90.0,
  "attack": {
    "damage": 10,
    "cooldown": 1.0,
    "range": 6.0,
    "projectile_speed": 12.0
  },
  "targeting": {
    "targets": ["ground"],
    "priority": "nearest"
  },
  "damage_type": "physical",
  "tags": ["projectile", "physical"],
  "upgrades": [
    {"id": "focused_beam", "name": "Focused Beam", "cost": 35, "attack": {"damage": 14}},
    {"id": "quick_trigger", "name": "Quick Trigger", "cost": 55, "attack": {"cooldown": 0.75}},
    {"id": "extended_lens", "name": "Extended Lens", "cost": 75, "attack": {"damage": 20, "range": 7.0}}
  ]
}
